{
  "$schema": "./safety-v1.operator-applicability.schema.json",
  "schema": "plane.agent.safety-operator-applicability/v1",
  "matrix_id": "plane-agent-safety-applicability-v1",
  "qualification_status": "candidate_unimplemented",
  "predicate_set_id": "plane-agent-tooling-safety-predicates-v1",
  "operator_registry_id": "plane-agent-safety-operators-v1",
  "mutation_catalog_id": "plane-agent-safety-mutations-v1",
  "companion_rules": {
    "cartesian_product": "exact_40_predicates_by_12_cases",
    "unique_key": "predicate_id_mutation_case_id",
    "mutation_case_resolution": "exact_id_and_class_from_bound_qualifying_catalog",
    "operator_binding": "derive_from_predicate_set",
    "disposition": "derive_from_required_mutation_classes_and_resolved_case_class",
    "detector": "integrity_classes_use_auth_precondition_domain_classes_use_predicate_operator",
    "failure_code": "derive_from_detector_registry_contract",
    "reject_all_not_applicable": true,
    "required_predicate_mutation_classes": "must_detect",
    "bundle_mutation_class_coverage": "all_12_must_detect",
    "qualifying_state_agreement": "operator_registry_qualifying_pinned_mutation_catalog_and_applicability_qualifying_implemented",
    "integrity_detection": "all_four_integrity_classes_must_detect_for_all_40_predicates_via_auth_precondition",
    "integrity_cell_count": "exactly_160_of_480",
    "evidence_inputs": "schema_closed_canonical_sequences",
    "argument_variant_slots": "all_required_slots_present_before_live_execution"
  },
  "predicate_cells": [],
  "control_cells": [],
  "state_bindings": {
    "operator_registry": "candidate_unpinned",
    "mutation_catalog": "candidate_unimplemented",
    "applicability": "candidate_unimplemented"
  }
}
